{
  "schema": "data-package/v1",
  "id": "DP-axon-REDACTED-0001",
  "thread": "thread:axon-20260804-g001",
  "contract": "XC-axon-goldenexport@1.0.0#sha256:f5678dc75bcd99f7236e0aa8a139359f8df2b9242b6870c075ef0bb6799d7da4",
  "mode": "snapshot",
  "classification": "internal",
  "data_profile": "synthetic",
  "format": "json",
  "transport_driver": "space-git",
  "locator": "axon/data/DP-axon-REDACTED-0001",
  "entries": [
    {
      "path": "orders.json",
      "role": "dataset",
      "media_type": "application/json",
      "conforms_to": "schema/goldenexport.schema.json",
      "size_bytes": 23,
      "digest": "sha256:c0a2c3a04a0e344c88914fd51ecc45ae22d79aebe28a8e97fe022a60706bddfc",
      "record_count": 1
    }
  ],
  "aggregate_digest": "sha256:2631bfd7c6e40e97fe088fba2c64ac77600e16bc955ff3172111e92f3778029a",
  "size_bytes": 23,
  "record_count": 1,
  "created_at": "REDACTED-TIMESTAMP",
  "expires_at": "REDACTED-TIMESTAMP",
  "attempt": 1,
  "provenance": {
    "origin_system": "axon",
    "extracted_at": "REDACTED-TIMESTAMP"
  }
}
