{
  "schema": "data-package/v1",
  "id": "DP-axon-20260804-k3f9",
  "thread": "thread:axon-20260721-k3f9",
  "contract": "XC-axon-order-api@2.3.0#sha256:aaaaaaaaaaaaaaaaaaaaaaaaaaaaaaaaaaaaaaaaaaaaaaaaaaaaaaaaaaaaaaaa",
  "mode": "snapshot",
  "classification": "restricted",
  "data_profile": "synthetic",
  "format": "json",
  "transport_driver": "space-git",
  "locator": "checkout-core/deliveries/DP-axon-20260804-k3f9",
  "entries": [
    {
      "path": "data/orders.json",
      "role": "dataset",
      "media_type": "application/json",
      "conforms_to": "schema/order.schema.json",
      "size_bytes": 4096,
      "digest": "sha256:bbbbbbbbbbbbbbbbbbbbbbbbbbbbbbbbbbbbbbbbbbbbbbbbbbbbbbbbbbbbbbbb",
      "record_count": 12
    },
    {
      "path": "README.md",
      "role": "readme",
      "media_type": "text/markdown",
      "size_bytes": 128,
      "digest": "sha256:cccccccccccccccccccccccccccccccccccccccccccccccccccccccccccccccc"
    }
  ],
  "aggregate_digest": "sha256:dddddddddddddddddddddddddddddddddddddddddddddddddddddddddddddddd",
  "size_bytes": 4224,
  "record_count": 12,
  "created_at": "2026-08-04T12:00:00Z",
  "expires_at": "2026-09-04T12:00:00Z",
  "attempt": 1,
  "provenance": {
    "origin_system": "axon-orders-db",
    "cursor": "watermark-2026-08-04T11:59:00Z",
    "extracted_at": "2026-08-04T11:59:30Z"
  }
}
